Id;Judul;Url;Lulusan;Description;Gaji
38;https://www.ausbildung.de/stellen/ausbildung-fachinformatiker-in-m-w-d-systemintegration-bei-erzdioezese-muenchen-und-freising-kdoer-in-muenchen-bf606598-86cd-4562-b3c3-f64efa965751/;Training as an IT specialist (m/f/d) system integration at the Archdiocese of Munich and Freising KdöR in Munich;Middle maturity;Your future begins with us! The Archbishop Ordinariate of Munich carries out the tasks of diocese administration on behalf of the Archbishop of Munich and Freising. In the Archdiocese of Munich and Freising, around 16,000 people work in pastoral care, administration as well as in social institutions and educational institutions. We are looking for you for the Archbishop's Ordinariate of Munich from September 2024 as a trainee: real estate agent (location: 80333 Munich). The main training content is real estate management ( Rental, lease and leasehold management, supplemented by WEG administration in cooperation), real estate transactions (e.g. building land development, valuation and transactions supplemented by real estate sales in cooperation) as well as strategic real estate management. The focus of training in the final year of training is on “building management” and “construction project management”. The theoretical training takes place in block lessons at the Munich Vocational School for Finance, Real Estate and Automotive Industry. We offer you 3 years of varied and practical training as well as insight into various administrative areas and working with a modern ERP system (SAP), comprehensive support, Further training and seminar offers as well as exam preparation, training fee according to ABD (corresponds to TVöD), company pension scheme and, if applicable, Munich allowance as well as numerous additional benefits, e.g. B. Company canteen, extensive health and fitness offers a professional perspective with a future. Your requirements profile: at least a (bound) university entrance qualification and good grades in mathematics and English. Interest in using computers and a technical understanding of computer science. Curiosity, joy and openness to new technologies. Commitment, initiative and joy in working in a team. Identification with the goals and values ​​of the Catholic Church. You can find further information about the training offered as well as the Archbishop's Ordinariate of Munich and its facilities at www.erzbistum-muenchen.de. People with severe disabilities will be given priority if they are equally qualified. Take your future into your own hands! We look forward to receiving your meaningful application documents via the application portal by October 15, 2023 at the latest. The reference number for this advertisement is: 9485. Earnings during training according to collective agreement;-
39;https://www.ausbildung.de/stellen/ausbildung-fachinformatiker-m-w-d-in-dresden-bei-afbb-akademie-fuer-berufliche-bildung-ggmbh-in-dresden-89085e60-8161-4afd-928e-d6c8bd941a73/;Training as an IT specialist (m/f/d) in Dresden at AFBB Academy for Vocational Education gGmbH in Dresden;Middle maturity;Training for IT specialists (m/f/d) in Dresden IT specialists (m/f/d) specializing in “system integration” design, install and administer networked IT systems for internal and external customers. You inform customers, evaluate marketable IT systems and customer-specific solutions. You will also oversee the IT systems and be responsible for IT security and data protection measures. IT specialists (m/f/d) specializing in “application development” design and develop software solutions for internal and external customers. You observe IT security and data protection in all work. You advise customers on innovative business models and business processes. You accompany the software development from the needs analysis, through maintenance and adaptation to replacement with another software solution. Choice between 2 disciplines: system integration (FR SI) application development (FR AE) training content information technology systems, including architecture of IT systems, networks, data security and data protection Developing and providing applications, including project management, program development methods, databases, business processes, etc. Market research, customer advice, sales planning Preparation for the IHK final examination part I and II Advantages IHK qualification IT specialist (m/f/d) internship abroad lasting several weeks Additional qualifications: Linux programming for the Internet of Things (IoT) database and server administration internship abroad lasting several weeks with Europass Mobility Freelance ApprenticeshipsVisit our apprenticeship exchange and see which companies we are already working with in training to become IT specialists (m/f/d). Our apprenticeship service will also be happy to advise you and support you in finding the right apprenticeship position. You can find an overview of our training partners at www.afbb.de. We are looking forward to your application! Do you want to find out more? Then click in: www.afbb.de;-
40;https://www.ausbildung.de/stellen/ausbildung-zum-fachinformatiker-in-m-w-fuer-systemintegration-2024-bei-abus-august-bremicker-soehne-kg-in-affing-e3181cb3-82ed-4434-825d-b7045da3b107/;Training as an IT specialist (m/f) for system integration in 2024 at ABUS August Bremicker Söhne KG in Affing;Middle maturity;ABUS Security Center GmbH &amp Co. KGABUS Security Center is a manufacturer of innovative alarm systems, video surveillance systems, access control systems, door intercom systems and hazard detectors. As part of the ABUS Group, our company specializes in both industry-specific security needs and the requirements of private users. The focus is on the development of holistic and particularly user-friendly security products and complete security solutions. As a trainee, you can also count on our full support and accompany you on practical ABUS projects. Your career wish: “To make life a little safer.” - Then we have the right challenges! Area of ​​activity IT specialists (m/f) implement specialist and customer-specific requirements in hardware and software systems. In addition to analysis and planning, they support information and telecommunications systems and introduce new or modified systems. As specialists, they are central contacts, technical advisors and supervisors for users. In the “System Integration” specialty, you will advise, support and set up workstations on the IT side. Areas of focus of our 3-year training: Working in the user helpdesk (first/second level support) Supporting system and network administration Installing and supporting our applications Working on various projects Advice and user training This sets you apart for an optimal start: Special interest in IT Good prior mathematical knowledge as well as logical thinking and understanding Subject-related internships Enjoy working in a team as well as solving problems independently Middle school or (technical) high school diploma (college dropouts are welcome) Desirable: initial knowledge of a programming language You can expect from us Practical training in an internationally active, family-run company with an open working atmosphere and many extras: flexible working hours, food and beverage flat rate, subsidies for fitness programs, good transport connections. Training begins on September 1st, 2024. With you into our shared future. There's (actually) something cool to see here! This is a placeholder for video content from YouTube. Curious? Then unlock the content now. Yes, I allow external content from YouTube. I agree that the external content can be displayed to me. Personal data may be transmitted to third-party platforms. More information can be found in the data protection declaration.;-
41;https://www.ausbildung.de/stellen/ausbildung-fachinformatiker-in-fuer-digitale-vernetzung-m-w-d-bei-consol-consulting-solutions-software-gmbh-in-muenchen-1fbaf658-51ac-4961-bb99-060679b4f7f1/;Training as an IT specialist for digital networking (m/f/d) at ConSol Consulting & Solutions Software GmbH in Munich;Middle maturity;Training to become an IT specialist - digital networking (m/f/d)This is what awaits you with usWhether training or dual study - with us you have the opportunity to lay the foundation for your successful professional life. We look forward to accompanying you during this time. We have been an IHK training company for many years and want one thing above all: that you enjoy your vocational training and that you really learn something with us. You have a mentor at your side who you can contact at any time with any questions. We take great care to ensure that you go through different stages during your training and take on responsibility early on. If your training is successful, it can be assumed that you will be taken on at ConSol. We are looking for trainees for the 2024/2025 training year at the Munich location in the field of digital networking. Focus of your training Basics of professional IT Planning and implementing complex network environments Creating and monitoring security concepts for IT landscapes Building virtual networks in cloud environments Your profile At least a technical college entrance qualification or intermediate school leaving certificate with appropriate additional qualifications (e.g. professional experience or further training) Good grades in the natural sciences Subjects Good computer skills, preferably Unix/Linux Ideally knowledge of network construction Good knowledge of German and English This is usThe values ​​of courage, trust, excellence and clarity are much more than just concepts on paper. For us, they are the basis for our decisions, orientation for action and the basis on which we want to continuously improve our company. If it suits you, we should get to know each other! Simply send us your application by email to jobs@consol.de. For further information, please contact Ms. Heike Landau at +49-89-45841-100.;-
42;https://www.ausbildung.de/stellen/ausbildung-fachinformatiker-in-m-w-d-bei-stadtwerke-kiel-ag-in-kiel-d8c59f71-33c5-4843-81cf-af4bf4c36b41/;Training as an IT specialist (m/f/d) at Stadtwerke Kiel AG in Kiel;Middle maturity;Training to become an IT specialist for system integration (m/f/d)As an IT specialist, you will mainly work in the area of ​​system integration. This means that you will manage and further develop the automation and technical IT systems in our control centers, i.e. in the heart of the energy and water supply of Stadtwerke Kiel AG. Here you plan and configure IT systems, set them up according to requirements and operate and manage them. If malfunctions occur, you will support the experts in rectifying and limiting them. ContentYou will learn to coordinate the uninterrupted operation of the IT systems of the network control centers in Kiel-Hasse and the coastal power plant in Hasselfelde. You work with hardware, software and secondary technologies. You will also get to know the IT security systems and supervise hardware and software maintenance and carry out the regular system updates provided by the manufacturer. Later, you will provide technical support, supervision and training to other employees who use the systems. Your final exam includes a written and a practical exam before the Kiel Chamber of Commerce and Industry. The practical exam consists of working on a specialist task practically and preparing it theoretically. You will then present and explain the solution to the IHK examination committee. DurationThe training for IT specialists (m/f/d) lasts three years and ends with a two-part final examination, which consists of a written and an oral part as part of a specialist task. Our dual training partner is the Regional Vocational Training Center for Technology in Gaarden. Earnings during training according to collective agreement;-
43;https://www.ausbildung.de/stellen/ausbildung-zum-it-fachinformatiker-fuer-systemintegration-m-w-d-bei-com-plan-service-gmbh-in-dresden-ad05950c-6237-4741-aa9d-e11a86659329/;Training as an IT specialist for system integration (m/f/d) at COM plan + service GmbH in Dresden;Middle maturity;TestFor you, there is more to a computer than just gaming? Do you have an affinity for IT systems and don't want to miss any updates? Then join our team at COM plan + service GmbH for tailor-made solutions in the field of information and telecommunications technology. We are looking for determined trainees for our Dresden location for the training year 2024. What your training includes As a future specialist for system integration, you will get to know the functionalities of computer systems, software solutions and communication systems. You will become a specialist in analyzing customer needs in order to design individual IT systems and provide customers with comprehensive advice. You will learn how to install, configure and then put networked IT systems into operation and how to resolve malfunctions during ongoing operations. In addition, you will be available to provide customers with technical advice, support and training. The vocational school takes place in block classes at the vocational school center for electrical engineering in Dresden. As you can convince us, you have a good secondary school leaving certificate (secondary school leaving certificate) or Abitur. You always enjoyed the subjects of math, German and physics. You have been passionate about computer science for a long time. You enjoy putting your craftsmanship to the test in your free time. You are eager to learn new things, develop yourself and get involved. Ideally, you have a class B driving license. What you can expect from us The very high probability of being taken on after your successful training. Time for events and learning together with the other trainees. A steep learning curve due to the early transfer of responsibility to you. A collegial top team that guarantees an ideal working atmosphere. Free drinks and a fruit basket for a little refreshment in between. The opportunity to work from home (home office) with a laptop. The Germany ticket as a job ticket. Very good connections by public transport, even from outside. How to apply With your complete application documents (cover letter, CV, most recent certificates and assessments), preferably in a PDF file Have we piqued your curiosity or do you still have questions? Contact your contact person on 0351 88556-38, also via WhatsApp chat or apply directly to jobs-dresden@complan-und-service.de. We look forward to seeing you!COM plan + service GmbH Ms. Katina Scheel Fritz-Reuter-Str. 32 c 01097 Dresden Earnings during training 1st year965 €2. Year1020 €3. Year1075 €;"-1. Jahr => 965 €; 2. Jahr => 1020 €; 3. Jahr => 1075 €; "
44;https://www.ausbildung.de/stellen/ausbildung-zum-fachinformatiker-m-w-d-anwendungsentwicklung-systemintegration-bei-axel-springer-national-media-tech-gmbh-co-kg-in-berlin-50fe870b-5d12-407b-95bc-dd6185c579ce/;Training as an IT specialist (m/f/d) application development/system integration at Axel Springer National Media & Tech GmbH & Co. KG in Berlin;high school diploma;We firmly believe that the best ideas come from maximum collaboration between different experts. And there are quite a few of them at Axel Springer. Did you know that in addition to news media such as BILD and WELT, we also own almost 250 other brands? That's why we're happy to pass on our knowledge in numerous apprenticeships and study programs. With us you will gain practical work experience in one of the most innovative companies in the world. As a media and technology company, we value innovation and state-of-the-art technologies and are looking for employees who are enthusiastic about them. Our numerous companies, products and projects result in a broad tech stack, which we continually supplement with new technologies. Become an IT specialist and work with us to build the systemic framework for a successful digital media company. You will acquire and deepen IT knowledge and get an insight into business areas. You will learn practical skills such as developing and programming customer-specific software or testing and improving existing applications. You will learn programming languages Just as developer tools play a big role in your everyday life, you work on a variety of projects together with different colleagues from the most important IT departments. You have the opportunity to freely design topics in our numerous subsidiaries and different brands such as WELT, BILD, upday... You are a motivated training starter with a great interest in tech topics and, ideally, you already program small applications in your free time. You have successfully completed your high school diploma, your secondary school leaving certificate or a degree from a commercial college (soon). You are not only at home in the digital world, but also of the possibilities You are enthusiastic about digital media You enjoy working in a team but also take on personal responsibility You have motivation and organizational skills You have the ability to adapt to various topics Benefit from a_attractive training remuneration: €1,090 in the first, €1,150 in the second and €1,205 in the third year of training We will equip you with the latest hardware, such as a modern notebook and a smartphone, which you can also use privately. With us you will always work with the latest operating systems. Take part in our tech events, such as the Data & AI Tech Day, the DevOps Day, the Product Camp, the Developer Day or the annual TechCon, in addition to the events, you can exchange ideas and network with our tech experts from all over the world in teams and Slack channels. Take the opportunity to do an internship at home or abroad Flexible working hours in the modern Axel Springer Campus as well as mobile working are an integral part of the corporate culture FreeLunch - get free lunch in one of the great neighborhood restaurants We will get you ready for your intermediate and final exams and thus open up numerous career opportunities for you with the option of taking on a job after successfully completing your training Apply now with the following documents: Tabular CV Letter of motivation and certificates (Abitur certificate/MSA or the last 2 school certificates) Note: The letter of motivation and certificates (max. 10 MB per file) can be uploaded on the second page in the application process. If you have any questions, you can find initial answers here: career.axelspringer.com/de/faqIn order to make reading easier, we limit ourselves to male terms in the text. Nevertheless, diversity is an essential part of our corporate culture! We look forward to receiving all applications regardless of gender, nationality, ethnic and social origin, religion, ideology, disability, age, sexual orientation and identity. You can find information about the representation of severely disabled people at Axel Springer and contact details here: career.axelspringer.com/de /ksbv Earnings during training 1st year1090.00 €2. Year1150.00 €3. Year1205.00 €;"-1. Jahr => 1090,00 €; 2. Jahr => 1150,00 €; 3. Jahr => 1205,00 €; "
45;https://www.ausbildung.de/stellen/ausbildung-zum-fachinformatiker-in-fuer-systemintegration-m-w-d-bei-stadtwerke-heidenheim-ag-in-heidenheim-an-der-brenz-302542ea-ca8b-40fd-b08d-766daecae0c2/;Training as an IT specialist for system integration (m/f/d) at Stadtwerke Heidenheim AG in Heidenheim an der Brenz;Middle maturity;At Stadtwerke Heidenheim AG you have the opportunity to combine theory with practice and stand on your own feet financially. Diverse opportunities, interesting and future-oriented business areas, exciting tasks and diverse locations are waiting for you! And after your dual studies, you have a very good chance of being taken on. Become a real estate professional with us. So let's get going. Become part of our team and apply now for your dual study place. We look forward to seeing you! Installation and administration of servers, PC systems, smartphones and network components Support in finding and eliminating faults Participation in exciting IT projects Middle school or high school diploma Enjoyment of the subjects mathematics and physics Analytical-logical thinking skills Interest in IT systems and how they work Earnings during training according to collective agreement;-
46;https://www.ausbildung.de/stellen/ausbildung-zum-fachinformatiker-m-w-d-fuer-systemintegration-beginn-01-09-2024-bei-carl-thiem-klinikum-cottbus-ggmbh-in-cottbus-4f6a916f-2abb-4e33-b7be-039cad131585/;Training as an IT specialist (m/f/d) for system integration - starting September 1st, 2024 at Carl-Thiem-Klinikum Cottbus gGmbH in Cottbus;Middle maturity;Training as an IT specialist (m/f/d) for system integration - Starts September 1st, 2024The Carl Thiem Clinic Cottbus is a non-profit GmbH run by the municipality and an academic teaching hospital of the Charité-Universitätsmedizin Berlin. As a renowned clinic with the highest medical standards, it is the largest employer in Cottbus with around 1,200 beds and over 2,500 employees. We employ over 200 colleagues from around 40 countries. At CTK, as a center for specialized care with 22 clinics, 4 institutes and numerous centers, almost all medical disciplines are available, serving well over 150,000 inpatient and outpatients per year. The first state university medicine in Brandenburg is being set up in Cottbus. To this end, the Carl Thiem Clinic Cottbus will be expanded into a university hospital and transferred to state ownership. The first students will begin studying human medicine at the Innovation Center University Medicine Cottbus (IUC) in the winter semester of 2026/2027. Training as an IT specialist (m/f/d) for system integration as of September 1st, 2024 Your area of ​​responsibility Designing and implementing complex systems of information and telecommunications technology through the integration of hardware and software components Installing, configuring and commissioning networked information and telecommunications technology systems Information technology and telecommunications systems Administer methods of project planning, project implementation and project control Eliminate faults through the use of expert and diagnostic systems Present system solutions Advise and train users Your profile Good school leaving certificate (intermediate school leaving certificate, (technical) university entrance qualification) Interest in technology & IT German language level: at least B2 Logical thinking skills and the ability to work independently and independently Sense of responsibility, motivation, strong communication skills, ability to work in a team This is what we offer you An exciting 3-year training course with alternating theoretical and practical phases Attractive training remuneration and additional annual special payment in accordance with the CTK's in-house collective agreement based on the collective agreement of public service30 days of vacation according to the collective agreement VBB-Azubi-Ticket Very good opportunities to be taken on after successful completion of training Intensive training with professional and personal support An exciting time in a highly dynamic company *All personal wording in this job advertisement is to be viewed in a gender-neutral manner.ContactIf you are looking for a future-proof career If you are passionate about teamwork and want to develop personally and professionally, then apply to us now using our application form using reference number: JW_1254. We look forward to hearing from you! We would be happy to answer your initial questions about the application process on Tel: 0355 46-3250 or at bewerbungen@ctk.de. Your personal contact is Ms. Julia Wilk. If you have any questions, please feel free to contact us via WhatsApp on 0160 96518789. If you have any technical questions, our head of MID, Sven Kleemann, will be happy to answer your questions on Tel: 0355-46 1449. Further information about the clinic can be found on our homepage www.ctk.deCarl-Thiem-Klinikum Cottbus gGmbH ÷ CTK recruiting team ÷ Thiemstraße 111, 03048 Cottbus ÷;-
