Id;Judul;Url;Lulusan;Description;Gaji
28;https://www.ausbildung.de/stellen/ausbildung-zum-zur-fachinformatiker-in-fuer-daten-und-prozessanalyse-m-w-d-bei-bonita-international-gmbh-co-kg-in-hamminkeln-7a068113-b958-41a8-b20c-caf075b882f1/;Training as an IT specialist for data and process analysis (m/f/d) at BONITA International GmbH & Co. KG in Hamminkeln;Not specified;Do you live fashion?Bonita has stood for current fashion and self-confident, modern femininity for over 50 years - in 24 collections per year. 1,900 employees from 42 nations work at over 500 POS in Germany, the Netherlands, Austria and Switzerland. You're the only one who's missing! This is what awaits you with us A varied training in a future-oriented company Interesting tasks and projects in different areas of IT The opportunity to contribute your own suggestions and ideas Individual support and promotion of your interests and skills An open, respectful and fair cooperation Very good chances of being taken on and exciting prospects after successful completion A modern workplace and short communication channels Covering costs and exemption for exam preparation courses Flexible working hours, 30 days vacation and special leave for various occasions You receive an additional day off on your birthday so that you can enjoy your special day You can receive free health offers - and use the fitness area. We also offer you the option of a heavily discounted membership, e.g. B. in fitness studios in cooperation with Urban Sports Club: depending on the package, you have an attractive offer from the sports and wellness area. Move a lot together! Become part of a great team and apply to us. We are looking forward to your application! Your tasks Your training starts on August 1st, 2024 and runs for 3 years. During this time you will gain insights into the different departments of a trading company, get to know standard business software (SAP ERP), how middleware systems work (e.g. SAP PO), in-house developments (e.g. branch system ) and analysis systems (e.g. SAP SAC, SAP BW) You work with tools and languages ​​(e.g. SQL) for database queries Analysis of existing business processes Recording requirements from the specialist departments Process design for new or changed business processes in IT systems Planning and carrying out software tests Carrying out your own projects from the requirement to the finished product Monitoring and error analysis of business processes You support the ERP & Sales Applications team You attend vocational school two days a week and also have the opportunity to develop yourself through in-house further training This is what we want from youYou have a very good secondary school leaving certificate (intermediate school leaving certificate) or a well-completed (technical) high school diploma. You are motivated to get to know a wide range of IT issues and processes. Ideally, you have good knowledge of Microsoft products (Word, Excel, Teams, Powerpoint, if necessary Visio). Motivation, Reliability and fun getting involved round off your profile ContactKristina PretzerBonita GmbHKesseldorfer Rott 3946499 Hamminkeln;-
29;https://www.ausbildung.de/stellen/ausbildung-fachinformatiker-in-m-w-d-bei-freie-hansestadt-bremen-aus-und-fortbildungszentrum-in-bremen-9f8cbae2-483d-4d1f-bec5-9c85c930d8d2/;Training as an IT specialist (m/f/d) at the Free Hanseatic City of Bremen training and further education center in Bremen;Secondary school diploma;IT specialist (f/m/d)The Free Hanseatic City of Bremen is recruiting trainees (f/m/d) on August 1, 2024 for the training occupation of IT specialist (f/m/d). You will complete the practical training in various departments and facilities of the Bremen public service or in Bremerhaven (bremenports GmbH &ampCo. KG). As an IT specialist/system integration, you will implement complex IT systems with software and hardware components. You configure and administer networked client and server systems. Your tasks include the systematic planning, implementation and control of projects as well as the elimination of disruptions with the help of expert systems. Firewall technology and IT security will also be constant topics throughout your training. IT specialists/application development mainly work on the development of software and multimedia applications. At the same time, you also concentrate, for example, on the development of newer programming options such as mobile programs (apps). Requirements: You can apply if you have at least a secondary or secondary school diploma (or a vocational training qualification or intermediate school qualification) or a level of education recognized as equivalent. Please attach the following documents to the application letter: CV, photocopy of the last school certificate and the final certificate from the general education school previously attended, photocopies of certificates of employment since leaving school. In the interests of climate protection, we would be pleased if you sent us your application documents electronically. If you do not have the opportunity to do this, please do not use application folders. Please do not include any original documents with your application, as we cannot send them back for cost reasons. Thank you! General information: Bremen is a cosmopolitan and tolerant city where people from different countries of origin live. We want this cultural diversity to be reflected in our employees. Competencies such as B. Multilingualism or experiences from other cultures are particularly valuable for us and helpful for working together. We would therefore like to encourage people with a migrant background to apply for this advertisement. In order to reduce the under-representation of women, especially in training occupations in the commercial and technical sector, women should be given priority if they have the same qualifications as their male competitors, unless personal reasons for a competitor outweigh them. Women are therefore expressly encouraged to apply. Individual working time models can be agreed upon for applicants with children. Priority will be given to severely disabled applicants who essentially have the same professional and personal suitability. The call for proposals is subject to the outstanding resolutions of the Senate and the Budget and Finance Committee. The job advertisement and further information can also be found on the Internet at www.karriere.bremen.de. If you have any questions, please do not hesitate to contact Mr. Röhrs: (Tel. 0421/361-59987, Email: stephan.roehrs@afz.bremen.de). Information in accordance with Article 13 of the General Data Protection Regulation for applicants We ask you to take note of the information on the collection of your personal data. You can find this under “Data protection declaration” on www.karriere.bremen.de. By sending your application documents, we assume that you agree to the collection of your personal data. Please send your application by November 30, 2023 with the reference number: FIAL 2024 to the Training and Further Education Center (AFZ), Ref. 40 Doventorscontrescarpe 172 B 28195 Bremen or by email* to ApplicationsBBiG@afz.bremen.de * Please note that contact and further information for the subsequent selection steps will be made via email.;-
30;https://www.ausbildung.de/stellen/ausbildung-zum-fachinformatiker-fuer-systemintegration-in-dortmund-m-w-d-bei-amprion-gmbh-in-dortmund-f2536c5a-da30-466b-99dc-143f8113401b/;Training as an IT specialist for system integration in Dortmund (m/f/d) at Amprion GmbH in Dortmund;Middle maturity;Amprion connects. Our transmission network transports electricity to 29 million people in an area from the North Sea to the Alps. A third of Germany's economic output is generated there. Our lines are society’s lifelines. We keep our network stable and secure - and pave the way for the energy transition: We are expanding our network and working on new ideas for a climate-friendly, safe and efficient energy system. Training as an IT specialist for system integration in Dortmund (m/f/d)As part of your training as an IT specialist (m/f/d) for system integration, you will get to know a wide range of information technology and gain insights into the tasks of different departments and functional areas. The following areas of activity await you, among others: planning, installation, configuration and administration of complex IT systems, cloud-based infrastructure and platforms, basics of programming, operating systems, networks and database systems, protection of our critical infrastructure from cyber attacks, conception and implementation of digitalization projects WHAT WE EXPECT: a Good to very good technical college entrance qualification or a higher school diploma Enjoyment of mathematical, economic and technical issues A quick comprehension Good English language skills Good communication skills and enjoy working in a team WHAT YOU CAN EXPECT FROM US: a highly exciting training in a dynamic working environment Challenging tasks from the Everyday life of a transmission system operator a lucrative training allowance your own company laptop and a company cell phone good chances of being taken on Are you interested? We would be pleased if you sent us your meaningful application documents via our online career portal. Applications from severely disabled people are welcome. More information about Amprion and current positions at www.amprion.net. Earnings during training according to collective agreement;-
31;https://www.ausbildung.de/stellen/ausbildung-fachinformatiker-in-m-w-d-fuer-systemintegration-bei-icn-gmbh-co-kg-in-dortmund-57f2ffb5-208c-4c6f-9e1a-e9eb3cdab8cd/;Training as an IT specialist (m/f/d) for system integration at ICN GmbH + Co. KG in Dortmund;Not specified;"We are looking for youAll ICN employees stand up for each other, offer help and can accept help. Everyone creates the basis for trusting cooperation through their behavior. We are open to new things, think outside the box and allow for different perspectives in the team. Our goal is to create a culture of mutual respect, trust, appreciation and security and to build a sense of community. “Gendering” is not relevant in our communication. No matter your nationality, religion, ethnic origin, worldview or sexual orientation - at ICN, people are the focus. We consider diversity to be a sensible ""must"" as it enables us to hire the most talented employees and helps us to be more innovative and efficient and to be a more creative company. We look forward to receiving your application! Your tasks: Advice and support for our customers on the phone and on site You analyze technical problems, independently derive suggested solutions and implement them in a result-oriented manner Installation and configuration of systems Implementation and troubleshooting of network technology What do we expect from you? General university entrance qualification, technical college entrance qualification, already completed training, university dropout or comparable You impress with an independent, solution-oriented way of working and communication skills. Very good knowledge of German is required, good knowledge of English is desirable. Determination and the ability to work in a team round off your profile. Do you feel addressed? Then we look forward to receiving your application as a PDF including your motivation and why you fit into our team.Contactz.Hd. Ms. Sina Hermannspan Joseph-von-Fraunhofer-Straße 2944227 Dortmund0231 975199-0bewerbung@icn.de";-
32;https://www.ausbildung.de/stellen/ausbildung-zum-fachinformatiker-m-w-d-bei-omexom-deutschland-in-zwickau-60530704-17be-409f-874f-ec1967282abe/;Training as an IT specialist (m/f/d) at Omexom Germany in Zwickau;Middle maturity;In a nutshell Start of training: September 1st, 2024 Duration of training: 3 years Training locations: The Omexom Ebehako in Zwickau A vocational school close to home Very good opportunities for employment and development following the training The training content For training to become an IT specialist, you can choose between two focuses choose - application development or system integration. At the vocational school you will receive all the theoretical basics relating to information technology, e.g. B. for programming software and operating IT systems. You can then apply this specialist knowledge in practice with us. You actively support our IT team in the IT support of our employees. You will help solve tickets in 1st level support. You will also learn how to set up IT workstations and put devices into operation. You can also explore other areas of Omexom and get a great overview of the company and its business. Your advantages and perspective1 TOP TRAINING WITH VARIETY With us you will receive excellent and practical vocational training in which you will be optimally prepared for your professional life. There is no boring routine! There is always variety through rotation, a variety of tasks or the change between inside and outside sales. 2 JOB WITH MEANING The best way to achieve the energy transition is to help shape it. And that’s exactly what you can do with Omexom! As part of Omexom, you are doing your part for a safe, sustainable and fairer future. 3 YOU HAVE AN EXCITING PERSPECTIVE FOR YOUR CAREER The energy industry is constantly developing and offers careers with a future. Energy is more important than ever! At Omexom you have a secure career start and at the same time many doors are open to you to develop further within the company - be it to a position with more responsibility or assignments abroad. 4 OFFERS FOR YOU Work isn't everything! As part of the Vinci Group, we offer you extensive benefits. From the share program to company pension schemes, company health management, purchasing advantages, bonus payments and much, much more. We also provide the best possible support for the compatibility of work, leisure and family. 5 CONTINUING EDUCATION Your individual support is very important to us, which is why our company academy offers special support and management programs for your career advancement as well as a variety of opportunities for your personal and professional development. 6 TEAM FEELING – BECOME PART OF A STRONG TEAM! We attach great importance to team building and exchange! That's why we regularly invite you to events and company parties. A special event of the year is the trainee days, where you get to know all the trainees from all over Germany. But Christmas parties, excursions and other events also give you the opportunity to grow together with your colleagues. 7 SAFETY People are our top priority. That's why occupational safety is so important to us. Our goal: zero accidents! What you bring with you You have successfully completed secondary school or are about to graduate. You have good performance in mathematics and physics and a strong technical understanding. You enjoy using the PC and find it easy to get used to new systems. In addition, you may have already gained initial experience in programming or setting up IT systems. You definitely impress with your commitment, curiosity and your interest in technology. You also enjoy working in a team.;-
33;https://www.ausbildung.de/stellen/ausbildung-zum-fachinformatiker-m-w-d-systemintegration-beginn-2024-bei-scheidt-bachmann-gmbh-in-moenchengladbach-105483d8-2e4a-4770-a571-b1fc401d7754/;TRAINING AS AN IT SPECIALIST (M/F/D) SYSTEM INTEGRATION (START 2024) at Scheidt & Bachmann GmbH in Mönchengladbach;Not specified;TRAINING AS AN IT SPECIALIST (M/F/D) SYSTEM INTEGRATION (START 2024)You know that TikTok is not the only network and that a bus system has nothing to do with local public transport? If you use computers for more than just video games, then you should apply for our training as an IT specialist (m/f/d) systems integration. The focus is on the planning and configuration of IT systems. What awaits you with us: You analyze the requirements of internal and external customers. You will learn how to control the planning, setup, maintenance and administration of systems and network structures. You support the selection and installation of hardware and software. You will learn how to provide professional advice, support and training for your customers. You will take part in vocational school classes at the Uerdingen vocational college in Krefeld as well as in-house training measures and learn about operating systems, network technologies, firewalls and data encryption, among other things. To really get started with us, you should have the following: Successfully completed general university entrance qualification, technical college entrance qualification, ideally with a focus on information technology, or technical college entrance qualification Good grades in German, English and mathematics Good understanding of technical contexts Enjoyment of technology Independent and precise way of working Teamwork and service orientation We offer: Multi-award-winning training Structured buddy system Company and English lessons Targeted exam preparation A motivated team of trainers Collegial working atmosphere Modern company restaurant Above-average remuneration plus special payments 6 weeks of vacation per year plus free bridging days Earnings during training in accordance with the collective agreement;-
34;https://www.ausbildung.de/stellen/ausbildung-als-fachinformatiker-in-m-w-d-bei-neubrandenburger-stadtwerke-gmbh-in-neubrandenburg-36a6e1fd-9bf3-4d17-b04c-334d32877abe/;Training as an IT specialist (m/f/d) at Neubrandenburger Stadtwerke GmbH in Neubrandenburg;Middle maturity;Training content IT specialists (m/f/d) specializing in system integration plan and configure IT systems. As a service provider in-house or at the customer's, they set up these systems according to the requirements and operate or manage them. This also includes, when malfunctions occur, they systematically isolate and correct errors using modern expert and diagnostic systems. You advise internal and external users on the selection and use of devices and solve application and system problems. In addition, they create system documentation and conduct training for users. As an IT specialist (m/f/d), you will work at our subsidiary neu-itec GmbH and, among other things, ensure and support the functionality of all application software for our employees and external customers the entire workplace technology. Requirement: good secondary school diploma or high school diploma, analytical and logical thinking skills, team spirit, good knowledge of English. We offer you: annual learning material allowance, health and sports offers, job ticket, company events, further training and further education, in-house company bistro and lunch subsidy 1st year1069.26 €2. Year1118.2 €3. Year1164.02 €;"-1. Jahr => 1069,26 €; 2. Jahr => 1118,2 €; 3. Jahr => 1164,02 €; "
35;https://www.ausbildung.de/stellen/ausbildung-fachinformatiker-in-anwendungsentwicklung-m-w-d-bei-d7-consulting-gmbh-in-ehingen-donau-3aae09a3-e216-4500-8def-00ea7fc4da05/;Training IT specialist in application development (m/f/d) at d7 Consulting GmbH in Ehingen (Donau);Middle maturity;Your tasks During your 3-year training you will learn theoretical basics in vocational school lessons. On your practical days we offer participation in a wide range of tasks and taking on project tasks from conception to development to quality assurance & documentation. Research and development of new topics relating to digitalization &amp SAP Your profile Middle school diploma, high school diploma or technical college entrance qualification Affinity to technology and logical way of thinking Interest in modern topics related to software development We offer a great team, diverse project work, customers from different industries Varied and practical training, focus on SAP Diverse opportunities for further development;-
36;https://www.ausbildung.de/stellen/ausbildung-fachinformatiker-in-m-w-d-fuer-systemintegration-bei-erwin-hymer-group-se-in-bad-waldsee-22b08a30-35e2-4abf-ac0f-29a866ea48f7/;Training as an IT specialist (m/f/d) for system integration at Erwin Hymer Group SE in Bad Waldsee;Middle maturity;As an IT specialist for system integration, you are responsible for planning and configuring IT systems and ensuring that everything runs technically according to customer requirements. The training starts on September 1st, 2024 and lasts three years. It takes place in cooperation with the Tettnang Electronics School. Your tasks Planning, installation, configuration and management of complex networked IT systems through integration of hardware and software components Planning, operation and maintenance of the local data center Commissioning of client, server, network and telecommunications systems Methods for project planning, implementation and control Systematic troubleshooting using diagnostic systems Development and presentation of system solutions Technical advice, support and training of users Ensuring company and IT security guidelines Preparation of system documentation and quality assurance Your profile Completed technical college entrance qualification or intermediate school leaving certificate or your graduation is about to begin Experience and fun in dealing with Computers and software Good performance in mathematics and computer science is an advantage. Previous knowledge of general information technologies and technology is an advantage. Interest in the conception and implementation of IT and telecommunications systems. Interest in business management. Good knowledge of English. Open nature and enjoy working in a team. Independence and initiative. We offer exciting and varied tasks with a lot of creative freedom in an international group of companies Support from our trainers, who will work with you to develop a personally tailored training plan Participation in the flexible working time system The opportunity to get to know another Erwin Hymer Group location in addition to Bad Waldsee Group-wide trainee days, targeted training and... Further training offers as part of our EHG Academy as well as diverse perspectives after training. Interested? Then we look forward to receiving your meaningful online application via our application portal. If you have any questions, Carina Geiger will be happy to help you at carina.geiger@erwinhymergroup.com.;-
37;https://www.ausbildung.de/stellen/ausbildung-als-fachinformatiker-in-m-w-d-anwendungsentwicklung-bei-versandhaus-walz-gmbh-in-bad-waldsee-9ced9b2a-d9e9-4637-b83c-8ab87bdbdf95/;Training as an IT specialist (m/f/d) application development at Versandhaus Walz GmbH in Bad Waldsee;Middle maturity;Your tasks: Planning, implementing and supervising software projects Programming in different languages ​​Checking and adapting existing business processes and much more. Your profile: intermediate level, ideally vocational school/vocational college/technical college entrance qualification in the IT sector, good previous knowledge of hardware and software, technical understanding and analytical skills, motivation and willingness to learn Vocational school: Karl-Arnold-Schule Biberach or Elektronik-Schule Tettnang We offer: 30 days of vacation per year 37.5 hours per week Business laptop and the possibility of mobile working Employee-friendly flexitime regulations A pleasant working atmosphere in a motivated team Future-oriented and varied training with a high level Takeover rate Holiday and Christmas bonus Additional certificate bonus Company pension scheme & occupational disability insurance Meal subsidies for our in-house canteen Employee discount for our different ranges and with cooperation partners Free company parking space Flat hierarchies with a first-person culture This is how you can apply: You are interested in this training and your qualifications match our profile? Then we look forward to receiving your application. You can either send this to us by post or directly online via our career portal. Earnings during training 1st year920 €2. Year1010 €3. Year1140 € There's (actually) something cool to see here! This is a placeholder for video content from YouTube. Curious? Then unlock the content now. Yes, I allow external content from YouTube. I agree that the external content can be displayed to me. Personal data may be transmitted to third-party platforms. More information can be found in the data protection declaration.;"-1. Jahr => 920 €; 2. Jahr => 1010 €; 3. Jahr => 1140 €; "
