Id;Title;Url;Graduation;Salary;Description
39;IT specialist specializing in application development (m/f/d) 2024 at MDCC Magdeburg-City-Com GmbH in Magdeburg;https://www.ausbildung.de/stellen/fachinformatiker-fachrichtung-anwendungsentwicklung-m-w-d-2024-bei-mdcc-magdeburg-city-com-gmbh-in-magdeburg-b91b7c0b-9643-45de-8160-f19d7ca78cb4/;Middle maturity;"-1. Year => €1030; 2nd year => €1090; 3rd year => €1150;";Designing and implementing tasks Testing, adapting and documenting applications Advising, supporting and training users Planning, implementing and controlling projects Troubleshooting through the use of experts and diagnostic systems Development of application-friendly and ergonomic user interfaces Qualifications You have a good secondary school leaving certificate or ( You have a high school diploma, you have analytical thinking skills and technical understanding in the subjects of mathematics, German, English and computer science. You have good performance in computers, software and the Internet. You are enthusiastic about computers, you are communicative, open to new things and enjoy working in a team. Ideally, you have already had your first practical skills Gain experience with hardware/software or programming or your studies were too theoretical for you. This is how you apply to us. Cover letter stating your desired career, CV in tabular form, copy of the final certificate or the last two end-of-year certificates, if necessary, copies of internship certificates by October 31st, 2023 You should become an IT specialist if your dream job revolves around computers. Programming applications makes you happy. You work carefully, independently and goal-oriented. You work well at explaining and showing. You have patience and a willingness to learn. You are a team player and enjoy working with people Vocational schoolTheoretical training takes place at the “Otto von Guericke” vocational school in Magdeburg. Your advantages at MDCC Working in different specialist departments with changing areas of responsibility in order to get to know our employees, products and processes Very good training remuneration 30 days vacation and 38 hours / week Guarantee of employment if your performance is good Flexible and mobile working Individual and comprehensive support during the training Kick-off Start days and trainee fit seminars Comprehensive company health management Good connection with public transport & job ticket Free parking on site Regular company events Bonus for successful completion of training Earnings during training 1st year 1030 €2. Year1090 €3. Year1150 €
40;Training as an IT specialist (m/f/d) at Heinrich Heine University Düsseldorf in Düsseldorf;https://www.ausbildung.de/stellen/ausbildung-fachinformatiker-in-m-w-d-bei-heinrich-heine-universitaet-duesseldorf-in-duesseldorf-a911f7ee-c420-48e2-b979-c8b86bf16b5a/;Middle maturity;"-1. Year => €1086; 2nd year => €1140; 3rd year => €1190;";Training positions to become an IT specialist (m/f/d) - application development, system integration or data and process analysisTask focus You will learn how to deal with various components of the central IT infrastructure at Heinrich Heine University. You will learn IT solutions in all three departments to develop, create and support the ZIM in order to design the university's processes holistically and optimally support them with IT. You will learn the use of modern programming languages ​​and development environments in all areas. You will learn how to deal with planning, development, documentation and presentation of Projects Your ProfileThe prerequisite for employment is a technical college entrance qualification. In addition, we expect: good grades in mathematics and the natural sciences, interest in programming languages, the commissioning of storage solutions and the integration of IT systems, German language level B2 or native language, the motivation to work independently on IT topics, the ability to communicate, the ability to work in a team. Our offer is an interesting and a diverse training position at the Heinrich Heine University a detailed insight into the everyday life of the campus university an attractive training remuneration according to TVA-L BBiG an annual special payment of approx. 95% of your training remuneration 30 days of vacation and five special days of holiday for the final examinations a special bonus of 400 € after successful completion of the training, the payment of capital-forming benefits, great trainers and training representatives who will accompany and support you. Further information about our training can be found at www.hhu.de About usHeinrich Heine University Düsseldorf offers many people the opportunity every year to complete practical, high-quality training. Our trainees learn all of the job-specific processes and tasks at a university right here on campus and are thus ideally prepared for entering professional life. Heinrich Heine University represents the principle of “Excellence through Diversity”. She signed the “Diversity Charter” and successfully participated in the Stifterverband’s “Shaping Diversity” audit. It is certified as a family-friendly university and has set itself the goal of promoting diversity among its employees. Applications from people of all genders are expressly welcome. Applications from women will be given preferential consideration in accordance with the State Equal Opportunities Act. Applications from severely disabled people and disabled people of equal status are also welcome. In order to consider a severe disability or equality, please provide proof of this with suitable documents. Please send your application documents (CV, cover letter and certificates) exclusively via our application form:karriere.hhu.de Earnings during training 1st year 1086 €2. Year1140 €3. Year1190 €
41;Trainee as IT specialist for system integration from 08/2024 (m/f/d), AZIT-1266-AU at iC Consult Group GmbH in Essen;https://www.ausbildung.de/stellen/auszubildender-zum-fachinformatiker-fuer-systemintegration-ab-08-2024-m-w-d-azit-1266-au-bei-ic-consult-group-gmbh-in-essen-f6a2174e-2098-4085-aafb-525bef4acd38/;Middle maturity;"-1. year => €1050; 2nd year => €1100; 3rd year => €1150;";We are looking for a trainee as an IT specialist for system integration (m/f/d) for our location in Essen from August 1st, 2024 or September 1st, 2024. Your new field of activity Step by step you will get to know all the tasks that are carried out in the IT department in a medium-sized company IT companies The diverse focuses of your 3-year training range from IT helpdesk, server and network infrastructures, VPN/security technologies and monitoring to application support in your own data center and in the cloud. Short checklist of what you bring with you. You have yours You have completed a school career with an intermediate level of education or a high school diploma or a technical college entrance qualification. You have a good technical understanding and good PC and Windows knowledge. You show a strong commitment and enthusiasm for familiarizing yourself with new IT topics and are always up to date You are a team player and impress with your reliability, independence and sense of responsibility. Good written and spoken knowledge of German and English rounds off your profile. Your benefits - so that you feel completely at home with us. Practical training with involvement in all areas and processes IT in a medium-sized company 30 days vacation and high-quality equipment of your choice - whether Apple or Windows, you decide! A 3-day boot camp for your new start with us, in which you will be trained in IAM and various technologies iC Consult University - our comprehensive onboarding program accompanies you on your individual induction path with training modules, mentoring programs and events to promote your personal and professional Further training and career development, e.g. through internal training and development programs A personal coach, mobility support through the Deutschlandticket and a company sports membership are available to you Feelgood service, supports you in your private matters, e.g. with administrative or personal matters, organizing trips Employee discounts from well-known providers on products and services Regular team and company events in a relaxed atmosphere to strengthen the corporate climate Flat hierarchies, short decision-making processes and a high degree of personal responsibility with a lot of freedom to make decisions are what sets us apart. Convinced? Then send in your application! We are happy to answer any questions you may have and look forward to getting in touch with you soon! Send us your application documents (curriculum vitae, certificates) to karriere@ic-consult.com, stating the reference number AZIT-1266-AU. Or contact us in advance on Tel.: + 49 201 616162-0 | Contact person: Pascal MielkeDiversity in all dimensions is very important for our teams. We therefore include this criterion in our hiring decisions. This is usiC Consult is the leading independent consultant, system integrator and managed services provider for Identity & Access Management (IAM) with more than 800 employees worldwide. With our dedication to excellence and innovation and the best technologies in the IAM environment, we offer our customers first-class cyber security solutions. Our service portfolio includes managed services for IAM including consulting, architecture, implementation, integration, support and operations. iC Consult is headquartered in Munich and has branches in Germany, Switzerland, Austria, France, Belgium, Spain, Bulgaria, Great Britain, the USA, Canada, India and China. The world's biggest brands trust our expertise to protect and manage their most valuable assets: their identities. VerwaltungsiC Consult GmbHHuyssenallee 99-10345128 EssenT +49 201 616162-0E kontakt@ic-consult.comwww.ic-consult.comYou can find further information at: www.lovemyjob.ioThe protection of your data is important to us! That's why you can find all the information about how to handle your data in our data protection declaration: ic-consult.com Earnings during training 1st year1050 €2. Year1100 €3. Year1150 €
42;Training as an IT specialist (m/f/d) at the Free Hanseatic City of Bremen training and further education center in Bremen;https://www.ausbildung.de/stellen/ausbildung-fachinformatiker-in-m-w-d-bei-freie-hansestadt-bremen-aus-und-fortbildungszentrum-in-bremen-9f8cbae2-483d-4d1f-bec5-9c85c930d8d2/;Secondary school diploma;;IT specialist (f/m/d)The Free Hanseatic City of Bremen is recruiting trainees (f/m/d) on August 1, 2024 for the training occupation of IT specialist (f/m/d). You will complete the practical training in various departments and facilities of the Bremen public service or in Bremerhaven (bremenports GmbH &ampCo. KG). As an IT specialist/system integration, you will implement complex IT systems with software and hardware components. You configure and administer networked client and server systems. Your tasks include the systematic planning, implementation and control of projects as well as the elimination of disruptions with the help of expert systems. Firewall technology and IT security will also be constant topics throughout your training. IT specialists/application development mainly work on the development of software and multimedia applications. At the same time, you also concentrate, for example, on the development of newer programming options such as mobile programs (apps). Requirements: You can apply if you have at least a secondary or secondary school diploma (or a vocational training qualification or intermediate school qualification) or a level of education recognized as equivalent. Please attach the following documents to the application letter: CV, photocopy of the last school certificate and the final certificate from the general education school previously attended, photocopies of certificates of employment since leaving school. In the interests of climate protection, we would be pleased if you sent us your application documents electronically. If you do not have the opportunity to do this, please do not use application folders. Please do not include any original documents with your application, as we cannot send them back for cost reasons. Thank you! General information: Bremen is a cosmopolitan and tolerant city where people from different countries of origin live. We want this cultural diversity to be reflected in our employees. Competencies such as B. Multilingualism or experiences from other cultures are particularly valuable for us and helpful for working together. We would therefore like to encourage people with a migrant background to apply for this advertisement. In order to reduce the under-representation of women, especially in training occupations in the commercial and technical sector, women should be given priority if they have the same qualifications as their male competitors, unless reasons relating to the person of a competitor predominate. Women are therefore expressly encouraged to apply. Individual working time models can be agreed upon for applicants with children. Priority will be given to severely disabled applicants who have essentially the same professional and personal suitability. The call for proposals is subject to the outstanding resolutions of the Senate and the Budget and Finance Committee. The job advertisement and further information can also be found on the Internet at www.karriere.bremen.de. If you have any questions, please do not hesitate to contact Mr. Röhrs: (Tel. 0421/361-59987, Email: stephan.roehrs@afz.bremen.de). Information in accordance with Article 13 of the General Data Protection Regulation for applicants We ask you to take note of the information on the collection of your personal data. You can find this under “Data protection declaration” on www.karriere.bremen.de. By sending your application documents, we assume that you agree to the collection of your personal data. Please send your application by November 30, 2023 with the reference number: FIAL 2024 to the Training and Further Education Center (AFZ), Ref. 40 Doventorscontrescarpe 172 B 28195 Bremen or by email* to ApplicationsBBiG@afz.bremen.de * Please note that contact and further information for the subsequent selection steps will be made via email.
43;TRAINING AS AN IT SPECIALIST (M/F/D) SYSTEM INTEGRATION (START 2024) at Scheidt & Bachmann GmbH in Mönchengladbach;https://www.ausbildung.de/stellen/ausbildung-zum-fachinformatiker-m-w-d-systemintegration-beginn-2024-bei-scheidt-bachmann-gmbh-in-moenchengladbach-105483d8-2e4a-4770-a571-b1fc401d7754/;Not specified;;TRAINING AS AN IT SPECIALIST (M/F/D) SYSTEM INTEGRATION (START 2024)You know that TikTok is not the only network and that a bus system has nothing to do with local public transport? If you use computers for more than just video games, then you should apply for our training as an IT specialist (m/f/d) systems integration. The focus is on the planning and configuration of IT systems. What awaits you with us: You analyze the requirements of internal and external customers. You will learn how to control the planning, setup, maintenance and administration of systems and network structures. You support the selection and installation of hardware and software. You will learn how to provide professional advice, support and training for your customers. You will take part in vocational school classes at the Uerdingen vocational college in Krefeld as well as in-house training measures and learn about operating systems, network technologies, firewalls and data encryption, among other things. To really get started with us, you should have the following: Successfully completed general university entrance qualification, technical college entrance qualification, ideally with a focus on information technology, or technical college entrance qualification Good grades in German, English and mathematics Good understanding of technical contexts Enjoyment of technology Independent and precise way of working Teamwork and service orientation We offer: Multi-award-winning training Structured buddy system Company and English lessons Targeted exam preparation A motivated team of trainers Collegial working atmosphere Modern company restaurant Above-average remuneration plus special payments 6 weeks of vacation per year plus free bridging days Earnings during training in accordance with the collective agreement
44;Training as an IT specialist for data and process analysis (m/f/d) at BONITA International GmbH & Co. KG in Hamminkeln;https://www.ausbildung.de/stellen/ausbildung-zum-zur-fachinformatiker-in-fuer-daten-und-prozessanalyse-m-w-d-bei-bonita-international-gmbh-co-kg-in-hamminkeln-7a068113-b958-41a8-b20c-caf075b882f1/;Not specified;;Do you live fashion?Bonita has stood for current fashion and self-confident, modern femininity for over 50 years - in 24 collections per year. 1,900 employees from 42 nations work at over 500 POS in Germany, the Netherlands, Austria and Switzerland. You're the only one who's missing! This is what awaits you with us A varied training in a future-oriented company Interesting tasks and projects in different areas of IT The opportunity to contribute your own suggestions and ideas Individual support and promotion of your interests and skills An open, respectful and fair cooperation Very good chances of being taken on and exciting prospects after successful completion A modern workplace and short communication channels Covering costs and exemption for exam preparation courses Flexible working hours, 30 days vacation and special leave for various occasions You receive an additional day off on your birthday so that you can enjoy your special day You can receive free health offers - and use the fitness area. We also offer you the option of a heavily discounted membership, e.g. B. in fitness studios in cooperation with Urban Sports Club: depending on the package, you have an attractive offer from the sports and wellness area. Move a lot together! Become part of a great team and apply to us. We are looking forward to your application! Your tasks Your training starts on August 1st, 2024 and runs for 3 years. During this time you will gain insights into the different departments of a trading company, get to know standard business software (SAP ERP), how middleware systems work (e.g. SAP PO), in-house developments (e.g. branch system ) and analysis systems (e.g. SAP SAC, SAP BW) You work with tools and languages ​​(e.g. SQL) for database queries Analysis of existing business processes Recording requirements from the specialist departments Process design for new or changed business processes in IT systems Planning and carrying out software tests Carrying out your own projects from the requirement to the finished product Monitoring and error analysis of business processes You support the ERP & Sales Applications team You attend vocational school two days a week and also have the opportunity to develop yourself through in-house further training This is what we want from youYou have a very good secondary school leaving certificate (intermediate school leaving certificate) or a well-completed (technical) high school diploma. You are motivated to get to know a wide range of IT issues and processes. Ideally, you have good knowledge of Microsoft products (Word, Excel, Teams, Powerpoint, if necessary Visio). Motivation, Reliability and fun getting involved round off your profile ContactKristina PretzerBonita GmbHKesseldorfer Rott 3946499 Hamminkeln
45;Training as an IT specialist (m/f/d) at Omexom Germany in Zwickau;https://www.ausbildung.de/stellen/ausbildung-zum-fachinformatiker-m-w-d-bei-omexom-deutschland-in-zwickau-60530704-17be-409f-874f-ec1967282abe/;Middle maturity;;In a nutshell Start of training: September 1st, 2024 Duration of training: 3 years Training locations: The Omexom Ebehako in Zwickau A vocational school close to home Very good opportunities for employment and development following the training The training content For training to become an IT specialist, you can choose between two focuses choose - application development or system integration. At the vocational school you will receive all the theoretical basics relating to information technology, e.g. B. for programming software and operating IT systems. You can then apply this specialist knowledge in practice with us. You actively support our IT team in the IT support of our employees. You will help solve tickets in 1st level support. You will also learn how to set up IT workstations and put devices into operation. You can also explore other areas of Omexom and get a great overview of the company and its business. Your advantages and perspective1 TOP TRAINING WITH VARIETY With us you will receive excellent and practical vocational training in which you will be optimally prepared for your professional life. There is no boring routine! There is always variety through rotation, a variety of tasks or the change between inside and outside sales. 2 JOB WITH MEANING The best way to achieve the energy transition is to help shape it. And that’s exactly what you can do with Omexom! As part of Omexom, you are doing your part for a safe, sustainable and fairer future. 3 YOU HAVE AN EXCITING PERSPECTIVE FOR YOUR CAREER The energy industry is constantly developing and offers careers with a future. Energy is more important than ever! At Omexom you have a secure career start and at the same time many doors are open to you to develop further within the company - be it to a position with more responsibility or assignments abroad. 4 OFFERS FOR YOU Work isn't everything! As part of the Vinci Group, we offer you extensive benefits. From the share program to company pension schemes, company health management, purchasing advantages, bonus payments and much, much more. We also provide the best possible support for the compatibility of work, leisure and family. 5 CONTINUING EDUCATION Your individual support is very important to us, which is why our company academy offers special support and management programs for your career advancement as well as a variety of opportunities for your personal and professional development. 6 TEAM FEELING – BECOME PART OF A STRONG TEAM! We attach great importance to team building and exchange! That's why we regularly invite you to events and company parties. A special event of the year is the trainee days, where you get to know all the trainees from all over Germany. But Christmas parties, excursions and other events also give you the opportunity to grow together with your colleagues. 7 SAFETY People are our top priority. That's why occupational safety is so important to us. Our goal: zero accidents! What you bring with you You have successfully completed secondary school or are about to graduate. You have good performance in mathematics and physics and a strong technical understanding. You enjoy using the PC and find it easy to get used to new systems. In addition, you may have already gained initial experience in programming or setting up IT systems. You definitely impress with your commitment, curiosity and your interest in technology. You also enjoy working in a team.
