Id;Judul;Url;Lulusan;Description;Gaji
20;https://www.ausbildung.de/stellen/ausbildung-fachinformatiker-in-systemintegration-m-w-d-bei-siegfried-sander-gmbh-co-kg-in-osnabrueck-ec6356e6-bdbe-478e-a2e0-bf3250a61599/;Training as an IT specialist in system integration (m/f/d) at Siegfried Sander GmbH + Co. KG in Osnabrück;Middle maturity;This is what you bring with you: Are you looking for a training position for August 1st, 2024? Your favorite subjects are math, computer science, physics? Do you have a secondary school diploma or high school diploma? Do you want to have an area of ​​responsibility that is exciting and NEVER boring? Do you enjoy communicating with customers? This is what awaits you: Working in information and communication technology Planning, setting up and configuring IT systems Project management from the idea to implementation Dealing with operating systems and network technology Advising customers Problem analysis and solution Look forward to: The perfect mix of theory and practice Varied and responsible tasks Your own notebook for the duration of your training A safe, versatile and mobile workplace 28 days of vacation Planned employment if you are suitable Development support through internal and external training opportunities How to apply: CV with photo and your current certificate as well as any other proof of qualifications. You can send your complete documents to bewerbung@sander-buerosysteme.de, contact person Bernd Buchwald.;-
21;https://www.ausbildung.de/stellen/ausbildung-fachinformatiker-m-w-d-bei-reckli-gmbh-in-herne-bbf0c617-6860-450c-801c-319349475a03/;Training IT specialist (m/f/d) at RECKLI GmbH in Herne;High school diploma;RECKLI GmbH Welcome to the world of exposed concrete! We have been experts in individual facade design for over 55 years and, as a leading manufacturer of formliners, we take exposed concrete to the next level. In over 65 countries, we support architects, artists, precast concrete factories and construction companies in implementing their creative visions. Whether for concert halls or museums, our tailor-made shapes, handcrafted in our model making factory, give the architecture the finishing touch. But for us it's not just about concrete - we value humanity and individuality. Our customers and employees are just as unique as our products. Become part of our team and experience the fascinating world of architectural concrete! What we want from you: Honesty and reliability A friendly and open-minded manner High IT affinity or a high interest in technology High willingness to learn and comprehension Ability to work in a team Good knowledge of English A technical college entrance qualification or general university entrance qualification Class B driving license (desirable) What you will receive from us: a 3-year qualified training in an internationally successful company 37.5 hour week, flexitime 30 days vacation good training remuneration according to the collective agreement of the chemical industry annual performance bonus, future allowance and holiday pay a modern training position in a highly motivated and communicative team good prospects after successful completion of training Like you To become part of our team: send your meaningful application by email to AUSBILDUNG@RECKLI.DE Ms. Loreen Panek will be happy to assist you as your contact person. We look forward to receiving your application! Earnings during training according to the collective agreement There is (actually) something cool to see here! This is a placeholder for video content from YouTube. Curious? Then unlock the content now. Yes, I allow external content from YouTube. I agree that the external content can be displayed to me. Personal data may be transmitted to third-party platforms. More information can be found in the data protection declaration.;-
22;https://www.ausbildung.de/stellen/ausbildung-als-fachinformatiker-m-w-d-fuer-systemintegration-bei-mainova-ag-in-frankfurt-am-main-451b970a-c9ef-49d1-8eda-d527a707c7d7/;Training as an IT specialist (m/f/d) for system integration at Mainova AG in Frankfurt am Main;High school diploma;These challenges are waiting for you: Do you want to focus your career on the IT sector, are you a good communicator and enjoy working in a team? Then our 3-year training course is perfect for you! As an IT specialist for system integration, you install and configure networked information and telecommunications systems, design and implement IT systems by linking hardware and software. In addition, you will commission and support IT systems, project planning and execution, you will use diagnostic systems for troubleshooting and troubleshooting, you will advise and train customers and users. Variety is guaranteed: your vocational school is the Werner von Siemens School in Frankfurt . You attend these in block lessons and learn all the theoretical basics of the profession. In addition to vocational school, you will attend various courses offered by our training partner Provadis in order to acquire further qualifications. This is what you bring with you: a good high school diploma and math as your favorite subject, a passion for IT topics and technology, logical thinking skills, a good knowledge of English, a conscientious and structured way of working, a desire to make a difference, try out new things and learn from other people's experiences. These advantages are waiting for you: You will receive an attractive training allowance in accordance with the collective agreement and a Christmas bonus , performance bonuses for good grades and a company pension plan. Flexible working time models and 30 days of vacation offer ideal conditions for your balance between practice, vocational school and free time. After your training, we will take you on for at least a year – we guarantee that! You will receive a free job ticket for local public transport and benefit from discounted meals in our company restaurant. In our in-house fitness studio you can work out or take advantage of a variety of team sports, all free of charge! Have we sparked your interest? Then we look forward to getting to know you. Earnings during training 1st year1068.26 €2. Year1118.20 €3. Year1164.02 €4. Year1227.59 € There's (actually) something cool to see here! This is a placeholder for video content from YouTube. Curious? Then unlock the content now. Yes, I allow external content from YouTube. I agree that the external content can be displayed to me. Personal data may be transmitted to third-party platforms. More information can be found in the data protection declaration.;"-1. Jahr => 1068,26 €; 2. Jahr => 1118,20 €; 3. Jahr => 1164,02 €; 4. Jahr => 1227,59 €; "
23;https://www.ausbildung.de/stellen/ausbildung-zum-fachinformatiker-m-w-d-fuer-systemintegration-bei-volkswagen-infotainment-gmbh-in-bochum-00fab07d-cfa4-4d57-b1c7-d25540948a39/;Training as an IT specialist (m/f/d) for system integration at Volkswagen Infotainment GmbH in Bochum;Middle maturity;Training as an IT specialist (m/f/d) for system integrationWho we are:Volkswagen Infotainment was founded as a 100 percent subsidiary of Volkswagen AG in 2014. BlackBerry's European development center was taken over for the company headquarters in Bochum. The experienced team of 200 employees brought all the functions and competencies for the development of communication and control devices in the vehicle environment to the newly founded company. Volkswagen Infotainment is certified according to ISO 9001:2015. Today we have more than 1,000 people working on future vehicle networking technologies. We have been providing training in the technical and commercial areas since 2016 and are constantly expanding our training portfolio. With responsiveness, helpfulness and commitment, we prepare you for the IHK exam and provide support at vocational school. This is just as natural to us as the “you” in the entire company.Let's connect!If you are more interested in the source code of a website than colorful pictures, if you don't think of a snake when you think of Python and don't think of genetic material when you think of DNA, then training is a good idea An IT specialist (m/f/d) system integration might be just the thing for you. Our applicant day will take place in January 2024. Here we would like to introduce ourselves and our company and get to know you better. We look forward to receiving your application via our online portal! Please send us your complete application documents (application and motivation letter, CV, certificates)! Unfortunately, we cannot consider incomplete applications in the selection process. What we offer: 32 vacation days and special leave Plan and implement your own projects Mentoring program through trainee guides Insights into various departments and their specific requirements Training and further education opportunities Job ticket via Bogestra, company laptop and smartphone Employee and leasing offers Participation in companies - / Employee events, sports activities What you will learn: Planning, installing and configuring complex IT systems User training and presentation System integration and networks Service, advice and support, error analysis and troubleshooting Specific solution development Work organization, project management, quality assurance English documentation What you bring with you: High school diploma, technical college diploma or a good secondary school diploma Interest in technology, computers and programming Good knowledge of hardware or software and perhaps even some initial know-how in programming and “coding”, in your personal environment you regularly help with computer problems High level of initiative Team player Earnings during the Training 1st year1158.50 €2. Year1199.00 €3. Year1323.00 €;"-1. Jahr => 1158,50 €; 2. Jahr => 1199,00 €; 3. Jahr => 1323,00 €; "
24;https://www.ausbildung.de/stellen/fachinformatiker-in-systemintegration-bei-deutsche-bank-ag-in-eschborn-ff417dac-fd45-40d2-aaa8-c2ed8c0a1abf/;IT specialist system integration at Deutsche Bank AG in Eschborn;Middle maturity;Job descriptionYour training Your training lasts two and a half to three years, depending on your school qualifications. It begins in August with a starting week in which you get to know the trainees and dual students in your year, but also Deutsche Bank, better. During your training you can expect a varied mix of practice and theory. Each six weeks of intensive practice is followed by two weeks of vocational school. We attach great importance to ensuring that both areas are closely interlinked. We actively support your development throughout the entire training. A trainer is available to give you advice and assistance, and you will be supported in your daily work by a specialist contact person. With this highly qualified training, you will create the best foundations for a professional future as an IT specialist for system integration in the technology area of ​​our bank. Duration: 2.5 - 3 years (depending on school qualifications) Process: Alternating practical and vocational school phases Practice: Eschborn Vocational school: Hofheim Chamber of Industry and Commerce qualification Personal support throughout the entire training period Transparent assessment system with regular feedback discussions Best chances of being taken on if your performance is good to very good Good to very good secondary school diploma or good to very good (technical) university entrance qualification Interest in financial and technical contexts Creativity Perseverance Good analytical and linguistic skills;-
25;https://www.ausbildung.de/stellen/fachinformatiker-in-w-m-d-2024-standort-frankfurt-bei-kfw-bankengruppe-in-frankfurt-am-main-e2a9c167-d757-44b1-9ac1-47cce362ab1e/;IT specialist (f/m/d) - 2024 (Frankfurt location) at KfW Bankengruppe in Frankfurt am Main;Not specified;IT specialist (f/m/d) - 2024 (Frankfurt location)Welcome to KfW! We are an internationally active development bank that stands for the sustainable development of the environment, society and companies. As a source of inspiration, we are actively involved in the issues that will shape the world of tomorrow. We support wind farms, infrastructure projects, schools and hospitals because meaningful and sustainable projects are our mission. For us, shaping the world of tomorrow also means supporting young talent. We invite you to start your professional future with us. And we support your development along the way. your ideas. And we ensure that you are well prepared for everything that comes. Your career start at KfW We offer training to become an IT specialist in three disciplines: IT specialist for application development, IT specialist for system integration, IT specialist for data and process analysis In the practical phases Depending on your specialist area, you will get to know different areas of IT work: from developing new applications to solving application and system problems that arise and analyzing large data. Language is the key to the world: With our internal English course, you will also acquire a certified qualification that will take you further. Theory phases: In the block lessons at the vocational school, both topics relevant to the training and the so-called general education subjects are taught. Through additional specialist seminars, we support you in taking a good final examination at the Chamber of Commerce and Industry after three years. This is what you bring with a high school diploma/technical college entrance qualification or a good intermediate level of education Good knowledge of spoken and written German and English Interest and joy in organizing You are enthusiastic about dealing with people and impress with good manners and good expressiveness High sense of responsibility, reliability and discretion Flexibility and Openness to new experiences, commitment and fun working in a team;-
26;https://www.ausbildung.de/stellen/auszubildender-zum-fachinformatiker-fuer-systemintegration-ab-08-2024-m-w-d-azit-1266-au-bei-ic-consult-group-gmbh-in-essen-f6a2174e-2098-4085-aafb-525bef4acd38/;Trainee as IT specialist for system integration from 08/2024 (m/f/d), AZIT-1266-AU at iC Consult Group GmbH in Essen;Middle maturity;We are looking for a trainee as an IT specialist for system integration (m/f/d) for our location in Essen from August 1st, 2024 or September 1st, 2024. Your new field of activity Step by step you will get to know all the tasks that are carried out in the IT department in a medium-sized company IT companies The diverse focuses of your 3-year training range from IT helpdesk, server and network infrastructures, VPN/security technologies and monitoring to application support in your own data center and in the cloud. Short checklist of what you bring with you. You have yours You have completed a school career with an intermediate level of education or a high school diploma or a technical college entrance qualification. You have a good technical understanding and good PC and Windows knowledge. You show a strong commitment and enthusiasm for familiarizing yourself with new IT topics and are always up to date You are a team player and impress with your reliability, independence and sense of responsibility. Good written and spoken knowledge of German and English rounds off your profile. Your benefits - so that you feel completely at home with us. Practical training with involvement in all areas and processes IT in a medium-sized company 30 days vacation and high-quality equipment of your choice - whether Apple or Windows, you decide! A 3-day boot camp for your new start with us, in which you will be trained in IAM and various technologies iC Consult University - our comprehensive onboarding program accompanies you on your individual induction path with training modules, mentoring programs and events to promote your personal and professional Further training and career development, e.g. through internal training and development programs A personal coach, mobility support through the Deutschlandticket and a company sports membership are available to you Feelgood service, supports you in your private matters, e.g. with administrative or personal matters, organizing trips Employee discounts from well-known providers on products and services Regular team and company events in a relaxed atmosphere to strengthen the corporate climate Flat hierarchies, short decision-making processes and a high degree of personal responsibility with a lot of freedom to make decisions are what sets us apart. Convinced? Then send in your application! We are happy to answer any questions you may have and look forward to getting in touch with you soon! Send us your application documents (curriculum vitae, certificates) to karriere@ic-consult.com, stating the reference number AZIT-1266-AU. Or contact us in advance on Tel.: + 49 201 616162-0 | Contact person: Pascal MielkeDiversity in all dimensions is very important for our teams. We therefore include this criterion in our hiring decisions. This is usiC Consult is the leading independent consultant, system integrator and managed services provider for Identity & Access Management (IAM) with more than 800 employees worldwide. With our dedication to excellence and innovation and the best technologies in the IAM environment, we offer our customers first-class cyber security solutions. Our service portfolio includes managed services for IAM including consulting, architecture, implementation, integration, support and operations. iC Consult is headquartered in Munich and has branches in Germany, Switzerland, Austria, France, Belgium, Spain, Bulgaria, Great Britain, the USA, Canada, India and China. The world's biggest brands trust our expertise to protect and manage their most valuable assets: their identities. VerwaltungsiC Consult GmbHHuyssenallee 99-10345128 EssenT +49 201 616162-0E kontakt@ic-consult.comwww.ic-consult.comYou can find further information at: www.lovemyjob.ioThe protection of your data is important to us! That's why you can find all the information about how to handle your data in our data protection declaration: ic-consult.com Earnings during training 1st year1050 €2. Year1100 €3. Year1150 €;"-1. Jahr => 1050 €; 2. Jahr => 1100 €; 3. Jahr => 1150 €; "
27;https://www.ausbildung.de/stellen/ausbildung-zur-zum-fachinformatiker-in-m-w-d-bei-information-und-technik-nordrhein-westfalen-it-nrw-in-hagen-b79556a5-2d93-473a-9691-74f7ada528cd/;Training to become an IT specialist (m/f/d) at Information and Technology North Rhine-Westphalia (IT.NRW) in Hagen;Middle maturity;Your mission: Bring NRW forward digitallyAt IT.NRW it is about more than “just” a job. It's about an important social mission: making an entire federal state more digital. As a specialist in market and social research (m/f/d), you collect statistics and evaluate them so that they can be made available to all citizens. Get involved now and make an important contribution to 18 million citizens in NRW! Your area: IT training center and service bundleIn our IT training center (ITAZ) in Düsseldorf, you will receive comprehensive basic IT training together with the other trainees from your year. You will get to know all facets of IT, even with the PRINCE2 Foundation and ITIL Foundation certifications. After 18 months at ITAZ, you will be fit for all IT areas at IT.NRW and can successfully use your strengths and interests in the desired department. You can choose between system integration, where you will learn everything about networks, hardware and entire systems and the field of application development, where you develop software applications for IT.NRW and our customers. Creates meaning: Your training Duration of training: 3 years, it can be shortened to 2.5 years. You spend the first half of your training in the new IT training center in Düsseldorf. After 1.5 years, you switch to in-company training at the location of your choice (Düsseldorf or Hagen) You will be accompanied by experienced trainers You will attend the vocational school in Düsseldorf in the form of block lessons (we will provide your accommodation during this time) You can expand your knowledge through internal courses and external internships You can find all further information here : www.it.nrw Moves more: Your profile What you bring with you: High school diploma or a higher degree Successfully passed online recruitment test Also desirable: Motivation, willingness to learn and solution orientation Team spirit and service mentality Technical understanding and IT affinity Your benefits: fair remuneration the collective agreement for trainees from the TVA-L BBiG states • Close support from experienced trainers • ITAZ working hours (1.5 years): Mondays 8:00 a.m. to 4:00 p.m., Tuesdays to Fridays 8:00 a.m. to 3:30 p.m • Flexible working hours in the service bundles between 6:30 a.m. and 8:00 p.m. without core working hours • Barrier-free IT training center (learning environment) with plenty of space to discover and try things out • Trainees from the Hagen and Münster locations will be at ITAZ and the vocational school blocks during their time financially supported for accommodation in the Düsseldorf area• Health offers• Internal courses and external internships (also abroad)• Christmas bonus• Capital-forming benefits• Company pension plan: VBL• Very good career opportunities due to high take-on rates• After completing your training, you will continue your education and go through the operational phase Professional (degree at bachelor's level) • You can find all further information here: www.it.nrw We live diversity: We are particularly happy to receive applications from women and, in accordance with the LGG NRW, give preference to women in areas in which they are underrepresented. Applications from severely disabled people and disabled people with equal status within the meaning of Section 2 SGB IX are welcome. We are expressly committed to diversity in our working environment and welcome applications from all talents - regardless of age, gender and gender identity, ethnic and cultural origin, religion and belief, disability, sexual orientation and identity. That's why IT.NRW has signed the Diversity Charter www.charta-der-wandel. The right step: Your application Simply apply online now and join us in making an important contribution to 18 million people in North Rhine-Westphalia. Apply now &gt bewerbung.nrwPlease submit your application via our application portal by January 31, 2024. Your complete application includes the following documents: CV Relevant certificates Of course, we pay attention to data protection and treat your documents confidentially. Our application processPlease apply exclusively via our application portal (unfortunately, documents sent by email or post cannot be considered). After submitting your application, you will receive a confirmation of receipt. We will then check your documents. If the requirements are met, we will invite you to take the online test. We will inform you about the next steps as soon as possible. Your connection to usIf you have any questions about the application process, we will be happy to answer them:Barbara Roedel 0211 9449-6722 and Christina Morgenstern 0211 9449-6726Or by email to: bildung@it.nrw.de Earnings during the training 1st year1086.82 €2. Year1140.96 €3. Year1190.61 €;"-1. Jahr => 1086,82 €; 2. Jahr => 1140,96 €; 3. Jahr => 1190,61 €; "
